trace_id,phase0_selector,phase0_source,coverage_status,trace_class,semantic_justification,semantic_review_verdict,phase1_selectors,evidence_paths,notes
TRACE-SFA-CORE-ID-001,SFA-CORE-ID-001,SRC-PRD-P0,covered,implemented,,,SFA-P1-INIT-REPO-004,PRDs/Sys4AI_phase-0_product_system_design_prd.md;PRDs/Sys4AI_phase-1_implementation_initialization_prd.md;PRDs/modules/Sys4AI_system_layers_and_self_hosting_prd.md,Expanded from TRACE-P0-IDENTITY. Phase 1 preserves the Phase 0 authority surface outside the implementation package. AJ24 draft module owner: PRD-MOD-SYSTEM-LAYERS-SELF-HOSTING; not canonical.
TRACE-SFA-CORE-ID-002,SFA-CORE-ID-002,SRC-PRD-P0,covered,implemented,,,SFA-P1-INIT-REPO-004,PRDs/Sys4AI_phase-0_product_system_design_prd.md;PRDs/Sys4AI_phase-1_implementation_initialization_prd.md;PRDs/modules/Sys4AI_system_layers_and_self_hosting_prd.md,Expanded from TRACE-P0-IDENTITY. Phase 1 preserves the Phase 0 authority surface outside the implementation package. AJ24 draft module owner: PRD-MOD-SYSTEM-LAYERS-SELF-HOSTING; not canonical.
TRACE-SFA-CORE-ID-003,SFA-CORE-ID-003,SRC-PRD-P0,covered,implemented,,,SFA-P1-INIT-REPO-004,PRDs/Sys4AI_phase-0_product_system_design_prd.md;PRDs/Sys4AI_phase-1_implementation_initialization_prd.md;PRDs/modules/Sys4AI_system_layers_and_self_hosting_prd.md,Expanded from TRACE-P0-IDENTITY. Phase 1 preserves the Phase 0 authority surface outside the implementation package. AJ24 draft module owner: PRD-MOD-SYSTEM-LAYERS-SELF-HOSTING; not canonical.
TRACE-SFA-CORE-ID-004,SFA-CORE-ID-004,SRC-PRD-P0,partial,scaffolded,The canonical PRD and accepted decision define the composite identity while executable Meta-Agent Runtime evidence remains later work.,sufficient,SFA-P1-INIT-REPO-004,PRDs/Sys4AI_phase-0_product_system_design_prd.md;Sys4AI/control_records/director_decisions/DDR-SFADEV-STRATEGIC-BASELINE-001.yaml;Sys4AI/control_records/system_definition/strategic_baseline_migration_requirements_discovery_record.md;implementation_plans/Sys4AI-dev_strategic_baseline_migration_full_implementation_plan.md,TX-03 promotes the identity requirement only and does not claim runtime implementation.
TRACE-SFA-CORE-ID-005,SFA-CORE-ID-005,SRC-PRD-P0,partial,scaffolded,The canonical PRD defines authorized collaboration while executable runtime and verified host-profile evidence remain later work.,sufficient,SFA-P1-INIT-REPO-004,PRDs/Sys4AI_phase-0_product_system_design_prd.md;Sys4AI/control_records/director_decisions/DDR-SFADEV-STRATEGIC-BASELINE-001.yaml;implementation_plans/Sys4AI-dev_strategic_baseline_migration_full_implementation_plan.md,TX-03 records the product obligation without asserting current design development implementation test run maintenance or improvement capability.
TRACE-SFA-CORE-ID-006,SFA-CORE-ID-006,SRC-PRD-P0,partial,scaffolded,The canonical object boundaries are defined while artifact-schema and runtime-actor data migration remain later authorized transactions.,sufficient,SFA-P1-INIT-REPO-004,PRDs/Sys4AI_phase-0_product_system_design_prd.md;Sys4AI/control_records/director_decisions/DDR-SFADEV-STRATEGIC-BASELINE-001.yaml;implementation_plans/Sys4AI-dev_strategic_baseline_migration_full_implementation_plan.md,TX-03 establishes the source requirement and leaves schema and active-surface implementation to TX-08 through TX-12.
TRACE-SFA-CORE-ID-007,SFA-CORE-ID-007,SRC-PRD-P0,partial,scaffolded,The canonical execution-claim guardrail is defined while automated capability and semantic enforcement remain later validator work.,sufficient,SFA-P1-INIT-REPO-004,PRDs/Sys4AI_phase-0_product_system_design_prd.md;Sys4AI/control_records/director_decisions/DDR-SFADEV-STRATEGIC-BASELINE-001.yaml;implementation_plans/Sys4AI-dev_strategic_baseline_migration_full_implementation_plan.md,TX-03 records the prohibition and leaves validator implementation to TX-13.
TRACE-SFA-CORE-VISION-001,SFA-CORE-VISION-001,SRC-PRD-P0,partial,scaffolded,Canonical Phase 0 now contains one controlled candidate vision but accountable human approval evidence does not exist and G-08 remains open.,sufficient,SFA-P1-INIT-VAL-008,PRDs/Sys4AI_phase-0_product_system_design_prd.md;Sys4AI/control_records/system_definition/strategic_baseline_migration_requirements_discovery_record.md;implementation_plans/Sys4AI-dev_strategic_baseline_migration_full_implementation_plan.md,TX-04 section 5.1 establishes the candidate location without claiming that the approved-vision requirement is satisfied; the current Phase 1 selector provides trace-validation scaffolding only and TX-06 owns strategic initialization requirements.
TRACE-SFA-CORE-VISION-002,SFA-CORE-VISION-002,SRC-PRD-P0,partial,scaffolded,The candidate vision declares every required metadata field while approval evidence scenario thresholds and final G-08 disposition remain later work.,sufficient,SFA-P1-INIT-VAL-008,PRDs/Sys4AI_phase-0_product_system_design_prd.md;Sys4AI/control_records/system_definition/strategic_baseline_migration_requirements_discovery_record.md;implementation_plans/Sys4AI-dev_strategic_baseline_migration_full_implementation_plan.md,TX-04 section 5.1 records owner approval principal beneficiaries horizon scope exclusions success signals sources version revision triggers and supersession state; the current Phase 1 selector provides trace-validation scaffolding only and TX-06 owns strategic initialization requirements.
TRACE-SFA-CORE-VISION-003,SFA-CORE-VISION-003,SRC-PRD-P0,partial,scaffolded,The canonical candidate vision includes a non-anthropomorphism and no-purpose-setting-authority notice while semantic enforcement remains later validator and review work.,sufficient,SFA-P1-INIT-VAL-008,PRDs/Sys4AI_phase-0_product_system_design_prd.md;Sys4AI/control_records/system_definition/strategic_baseline_migration_requirements_discovery_record.md;implementation_plans/Sys4AI-dev_strategic_baseline_migration_full_implementation_plan.md,TX-04 section 5.1 states that the wording is stakeholder-directed candidate content rather than model desire or authority; the current Phase 1 selector provides trace-validation scaffolding only and TX-06 owns strategic initialization requirements.
TRACE-SFA-CORE-VALUES-001,SFA-CORE-VALUES-001,SRC-PRD-P0,partial,scaffolded,Canonical Phase 0 now contains eight stable-ID candidate values but they are not approved and G-08 remains open.,sufficient,SFA-P1-INIT-VAL-008,PRDs/Sys4AI_phase-0_product_system_design_prd.md;Sys4AI/control_records/system_definition/strategic_baseline_migration_requirements_discovery_record.md;implementation_plans/Sys4AI-dev_strategic_baseline_migration_full_implementation_plan.md,TX-04 section 5.2 establishes the complete candidate set without representing it as an approved value baseline; the current Phase 1 selector provides trace-validation scaffolding only and TX-06 owns strategic initialization requirements.
TRACE-SFA-CORE-VALUES-002,SFA-CORE-VALUES-002,SRC-PRD-P0,partial,scaffolded,Every candidate value declares the required commitment rationale behaviors decision test implications precedence source owner evidence and review fields while approval and scenario probes remain later work.,sufficient,SFA-P1-INIT-VAL-008,PRDs/Sys4AI_phase-0_product_system_design_prd.md;Sys4AI/control_records/system_definition/strategic_baseline_migration_requirements_discovery_record.md;implementation_plans/Sys4AI-dev_strategic_baseline_migration_full_implementation_plan.md,TX-04 sections 5.2.1 through 5.2.8 provide the reviewable field-complete candidate records; the current Phase 1 selector provides trace-validation scaffolding only and TX-06 owns strategic initialization requirements.
TRACE-SFA-CORE-VALUES-003,SFA-CORE-VALUES-003,SRC-PRD-P0,partial,scaffolded,Canonical Phase 0 defines value-trace scope and materiality while downstream schemas decisions evaluations maintenance and retirement evidence remain later transactions.,sufficient,SFA-P1-INIT-VAL-008,PRDs/Sys4AI_phase-0_product_system_design_prd.md;implementation_plans/Sys4AI-dev_strategic_baseline_migration_full_implementation_plan.md,TX-04 section 5.3 defines when affected value IDs must be cited and excludes trivial non-semantic changes; the current Phase 1 selector provides trace-validation scaffolding only and TX-06 owns strategic initialization requirements.
TRACE-SFA-CORE-VALUES-004,SFA-CORE-VALUES-004,SRC-PRD-P0,partial,scaffolded,Canonical Phase 0 defines binding precedence and states that values never grant permission while automated negative enforcement remains later validator and evaluation work.,sufficient,SFA-P1-INIT-VAL-008,PRDs/Sys4AI_phase-0_product_system_design_prd.md;Sys4AI/control_records/system_definition/strategic_baseline_migration_requirements_discovery_record.md;implementation_plans/Sys4AI-dev_strategic_baseline_migration_full_implementation_plan.md,TX-04 section 5.3 places law policy safety security privacy compliance source authority permissions and human approvals above value preferences; the current Phase 1 selector provides trace-validation scaffolding only and TX-06 owns strategic initialization requirements.
TRACE-SFA-CORE-VALUES-005,SFA-CORE-VALUES-005,SRC-PRD-P0,partial,scaffolded,Canonical Phase 0 prohibits runtime-actor self-approval while approval schemas separation-of-duties controls and negative tests remain later authorized work.,sufficient,SFA-P1-INIT-VAL-008,PRDs/Sys4AI_phase-0_product_system_design_prd.md;Sys4AI/control_records/system_definition/strategic_baseline_migration_requirements_discovery_record.md;implementation_plans/Sys4AI-dev_strategic_baseline_migration_full_implementation_plan.md,TX-04 sections 5.1 and 5.3 reserve approval to an accountable human principal and keep model roles advisory and executable only within authorization; the current Phase 1 selector provides trace-validation scaffolding only and TX-06 owns strategic initialization requirements.
TRACE-SFA-P0-FR-001,SFA-P0-FR-001,SRC-PRD-P0,covered,implemented,,,SFA-P1-INIT-REPO-004,PRDs/Sys4AI_phase-0_product_system_design_prd.md;PRDs/Sys4AI_phase-1_implementation_initialization_prd.md,Expanded from TRACE-P0-IDENTITY. Phase 1 preserves the Phase 0 authority surface outside the implementation package.
TRACE-SFA-P0-FR-002,SFA-P0-FR-002,SRC-PRD-P0,covered,implemented,,,SFA-P1-INIT-REPO-004,PRDs/Sys4AI_phase-0_product_system_design_prd.md;PRDs/Sys4AI_phase-1_implementation_initialization_prd.md,Expanded from TRACE-P0-IDENTITY. Phase 1 preserves the Phase 0 authority surface outside the implementation package.
TRACE-SFA-P0-FR-003,SFA-P0-FR-003,SRC-PRD-P0,covered,implemented,,,SFA-P1-INIT-REPO-004,PRDs/Sys4AI_phase-0_product_system_design_prd.md;PRDs/Sys4AI_phase-1_implementation_initialization_prd.md,Expanded from TRACE-P0-IDENTITY. Phase 1 preserves the Phase 0 authority surface outside the implementation package.
TRACE-SFA-P0-FR-004,SFA-P0-FR-004,SRC-PRD-P0,covered,implemented,,,SFA-P1-INIT-REPO-004,PRDs/Sys4AI_phase-0_product_system_design_prd.md;PRDs/Sys4AI_phase-1_implementation_initialization_prd.md;PRDs/modules/Sys4AI_domain_pack_prd.md,Expanded from TRACE-P0-IDENTITY. Phase 1 preserves the Phase 0 authority surface outside the implementation package. AJ24 draft module owner: PRD-MOD-DOMAIN-PACK; not canonical.
TRACE-SFA-CORE-LIFE-001,SFA-CORE-LIFE-001,SRC-PRD-P0,partial,scaffolded,G-03 accepts the complete lifecycle wording as an active normative requirement while exact Phase 1 implementation obligations and executable capability remain absent.,sufficient,SFA-P1-INIT-VAL-008,PRDs/Sys4AI_phase-0_product_system_design_prd.md;Sys4AI/control_records/director_decisions/DDR-SFADEV-STRATEGIC-BASELINE-G03-001.yaml;Sys4AI/control_records/system_definition/strategic_baseline_migration_requirements_discovery_record.md;implementation_plans/Sys4AI-dev_strategic_baseline_migration_full_implementation_plan.md,TX-05 defines the replacement and the separate G-03 disposition accepts it for implementation without claiming lifecycle capability; TX-06 owns exact Phase 1 lifecycle requirements.
TRACE-SFA-CORE-LIFE-002,SFA-CORE-LIFE-002,SRC-PRD-P0,partial,deferred,Phase 1 records baseline boundaries and Docker deferral; full lifecycle runtime execution is later-phase work.,sufficient,SFA-P1-INIT-REPO-004;SFA-P1-INIT-DOCKER-*,PRDs/Sys4AI_phase-0_product_system_design_prd.md;PRDs/Sys4AI_phase-1_implementation_initialization_prd.md;implementation_plans/phase-1_environment_decision_record.md;Sys4AI/docs/docker_decision_guide.md;PRDs/modules/Sys4AI_operations_improvement_maintenance_prd.md,Expanded from TRACE-P0-LIFECYCLE. Phase 1 initializes the implementation boundary and defers later lifecycle runtime choices. AJ24 draft module owner: PRD-MOD-OPERATIONS-MAINTENANCE; not canonical.
TRACE-SFA-CORE-LIFE-003,SFA-CORE-LIFE-003,SRC-PRD-P0,partial,deferred,Phase 1 records baseline boundaries and Docker deferral; full lifecycle runtime execution is later-phase work.,sufficient,SFA-P1-INIT-REPO-004;SFA-P1-INIT-DOCKER-*,PRDs/Sys4AI_phase-0_product_system_design_prd.md;PRDs/Sys4AI_phase-1_implementation_initialization_prd.md;implementation_plans/phase-1_environment_decision_record.md;Sys4AI/docs/docker_decision_guide.md;PRDs/modules/Sys4AI_operations_improvement_maintenance_prd.md,Expanded from TRACE-P0-LIFECYCLE. Phase 1 initializes the implementation boundary and defers later lifecycle runtime choices. AJ24 draft module owner: PRD-MOD-OPERATIONS-MAINTENANCE; not canonical.
TRACE-SFA-CORE-LIFE-004,SFA-CORE-LIFE-004,SRC-PRD-P0,partial,scaffolded,G-03 accepts every required stage-contract field for all eight stages while schemas transition validators and runtime evidence remain later authorized work.,sufficient,SFA-P1-INIT-VAL-008,PRDs/Sys4AI_phase-0_product_system_design_prd.md;Sys4AI/control_records/director_decisions/DDR-SFADEV-STRATEGIC-BASELINE-G03-001.yaml;Sys4AI/control_records/system_definition/strategic_baseline_migration_requirements_discovery_record.md;implementation_plans/Sys4AI-dev_strategic_baseline_migration_full_implementation_plan.md,TX-05 sections 6.2.1 and 14.2 provide the contract and coverage summary; TX-06 and TX-13 own implementation and validation requirements.
TRACE-SFA-CORE-LIFE-005,SFA-CORE-LIFE-005,SRC-PRD-P0,partial,scaffolded,G-03 accepts the distinction among test execution requirements verification stakeholder/system validation and behavioral/performance evaluation while automated semantic enforcement is later work.,sufficient,SFA-P1-INIT-VAL-008,PRDs/Sys4AI_phase-0_product_system_design_prd.md;Sys4AI/control_records/director_decisions/DDR-SFADEV-STRATEGIC-BASELINE-G03-001.yaml;Sys4AI/control_records/system_definition/strategic_baseline_migration_requirements_discovery_record.md;implementation_plans/Sys4AI-dev_strategic_baseline_migration_full_implementation_plan.md,TX-05 section 6.2.2 defines the four evidence questions and prohibits substitution; TX-13 owns focused semantic validation.
TRACE-SFA-CORE-LIFE-006,SFA-CORE-LIFE-006,SRC-PRD-P0,partial,scaffolded,G-03 accepts Test as both a named stage and cross-cutting gate while transition enforcement and negative cases remain later work.,sufficient,SFA-P1-INIT-VAL-008,PRDs/Sys4AI_phase-0_product_system_design_prd.md;Sys4AI/control_records/director_decisions/DDR-SFADEV-STRATEGIC-BASELINE-G03-001.yaml;implementation_plans/Sys4AI-dev_strategic_baseline_migration_full_implementation_plan.md,TX-05 Test and transition contracts require re-testing after maintenance improvement and material changes; TX-13 owns executable checks.
TRACE-SFA-CORE-LIFE-007,SFA-CORE-LIFE-007,SRC-PRD-P0,partial,scaffolded,G-03 accepts evidence-driven improvement and impact-based lifecycle re-entry while downstream change-impact schemas and workflow evidence remain later transactions.,sufficient,SFA-P1-INIT-VAL-008,PRDs/Sys4AI_phase-0_product_system_design_prd.md;Sys4AI/control_records/director_decisions/DDR-SFADEV-STRATEGIC-BASELINE-G03-001.yaml;Sys4AI/control_records/system_definition/strategic_baseline_migration_requirements_discovery_record.md;implementation_plans/Sys4AI-dev_strategic_baseline_migration_full_implementation_plan.md,TX-05 Improve contract and transition table route approved changes to the earliest affected stage without granting implementation permission.
TRACE-SFA-CORE-LIFE-008,SFA-CORE-LIFE-008,SRC-PRD-P0,partial,scaffolded,G-03 accepts the generic retirement minimum while target-specific obligations approval evidence schemas and demonstrations remain later work.,sufficient,SFA-P1-INIT-VAL-008,PRDs/Sys4AI_phase-0_product_system_design_prd.md;Sys4AI/control_records/director_decisions/DDR-SFADEV-STRATEGIC-BASELINE-G03-001.yaml;Sys4AI/control_records/system_definition/strategic_baseline_migration_requirements_discovery_record.md;implementation_plans/Sys4AI-dev_strategic_baseline_migration_full_implementation_plan.md,TX-05 Retire contract covers archival disposition withdrawal shutdown retained evidence notifications exceptions and residual ownership; target specifics remain an open issue.
TRACE-SFA-CORE-PATTERN-001,SFA-CORE-PATTERN-001,SRC-PRD-P0,partial,scaffolded,G-03 accepts coordination pattern and operational maturity as independent dimensions while exact template schema and validator fields await G-04 and later transactions.,sufficient,SFA-P1-INIT-VAL-008,PRDs/Sys4AI_phase-0_product_system_design_prd.md;Sys4AI/control_records/director_decisions/DDR-SFADEV-STRATEGIC-BASELINE-G03-001.yaml;Sys4AI/control_records/system_definition/strategic_baseline_migration_requirements_discovery_record.md;implementation_plans/Sys4AI-dev_strategic_baseline_migration_full_implementation_plan.md,TX-05 sections 6.2.3 through 6.2.5 and 6.3.2 define the independent dimensions without changing blocked template surfaces.
TRACE-SFA-CORE-PATTERN-002,SFA-CORE-PATTERN-002,SRC-PRD-P0,partial,scaffolded,G-03 accepts the five permitted coordination-pattern values while enum schemas compatibility rules and extension governance remain later contract work.,sufficient,SFA-P1-INIT-VAL-008,PRDs/Sys4AI_phase-0_product_system_design_prd.md;Sys4AI/control_records/director_decisions/DDR-SFADEV-STRATEGIC-BASELINE-G03-001.yaml;implementation_plans/Sys4AI-dev_strategic_baseline_migration_full_implementation_plan.md,TX-05 section 6.2.3 defines linear workflow goal-directed autonomous agent role-based multi-agent production orchestration and hybrid as controlled values.
TRACE-SFA-CORE-PATTERN-003,SFA-CORE-PATTERN-003,SRC-PRD-P0,partial,scaffolded,G-03 accepts rapid prototyping as maturity rather than architecture while negative schema and validator enforcement remains later work.,sufficient,SFA-P1-INIT-VAL-008,PRDs/Sys4AI_phase-0_product_system_design_prd.md;Sys4AI/control_records/director_decisions/DDR-SFADEV-STRATEGIC-BASELINE-G03-001.yaml;Sys4AI/control_records/system_definition/strategic_baseline_migration_requirements_discovery_record.md;implementation_plans/Sys4AI-dev_strategic_baseline_migration_full_implementation_plan.md,TX-05 pattern and maturity sections explicitly prohibit prototype as a pattern and prohibit maturity inference from architecture.
TRACE-SFA-CORE-PATTERN-004,SFA-CORE-PATTERN-004,SRC-PRD-P0,partial,scaffolded,G-03 accepts every required pattern-decision field while typed Director Decision schema template review and validation await G-04 and TX-07/TX-13.,sufficient,SFA-P1-INIT-VAL-008,PRDs/Sys4AI_phase-0_product_system_design_prd.md;Sys4AI/control_records/director_decisions/DDR-SFADEV-STRATEGIC-BASELINE-G03-001.yaml;Sys4AI/control_records/system_definition/strategic_baseline_migration_requirements_discovery_record.md;implementation_plans/Sys4AI-dev_strategic_baseline_migration_full_implementation_plan.md,TX-05 section 6.2.5 records the complete decision contract and explicitly blocks concrete contract activation before G-04.
TRACE-SFA-CORE-PATTERN-005,SFA-CORE-PATTERN-005,SRC-PRD-P0,partial,scaffolded,G-03 accepts fail-closed prototype-to-production evidence obligations while thresholds approval records negative tests and runtime enforcement remain later work.,sufficient,SFA-P1-INIT-VAL-008,PRDs/Sys4AI_phase-0_product_system_design_prd.md;Sys4AI/control_records/director_decisions/DDR-SFADEV-STRATEGIC-BASELINE-G03-001.yaml;Sys4AI/control_records/system_definition/strategic_baseline_migration_requirements_discovery_record.md;implementation_plans/Sys4AI-dev_strategic_baseline_migration_full_implementation_plan.md,TX-05 Test Run maturity risk acceptance and open-issue sections require evaluation security integration ownership rollback monitoring incident response and accountable approval evidence.
TRACE-SFA-P0-FR-014,SFA-P0-FR-014,SRC-PRD-P0,partial,deferred,Phase 1 records baseline boundaries and Docker deferral; full lifecycle runtime execution is later-phase work.,sufficient,SFA-P1-INIT-REPO-004;SFA-P1-INIT-DOCKER-*,PRDs/Sys4AI_phase-0_product_system_design_prd.md;PRDs/Sys4AI_phase-1_implementation_initialization_prd.md;implementation_plans/phase-1_environment_decision_record.md;Sys4AI/docs/docker_decision_guide.md,Expanded from TRACE-P0-LIFECYCLE. Phase 1 initializes the implementation boundary and defers later lifecycle runtime choices.
TRACE-SFA-P0-FR-015,SFA-P0-FR-015,SRC-PRD-P0,partial,deferred,Phase 1 records baseline boundaries and Docker deferral; full lifecycle runtime execution is later-phase work.,sufficient,SFA-P1-INIT-REPO-004;SFA-P1-INIT-DOCKER-*,PRDs/Sys4AI_phase-0_product_system_design_prd.md;PRDs/Sys4AI_phase-1_implementation_initialization_prd.md;implementation_plans/phase-1_environment_decision_record.md;Sys4AI/docs/docker_decision_guide.md,Expanded from TRACE-P0-LIFECYCLE. Phase 1 initializes the implementation boundary and defers later lifecycle runtime choices.
TRACE-SFA-P0-NFR-007,SFA-P0-NFR-007,SRC-PRD-P0,partial,deferred,Phase 1 records baseline boundaries and Docker deferral; full lifecycle runtime execution is later-phase work.,sufficient,SFA-P1-INIT-REPO-004;SFA-P1-INIT-DOCKER-*,PRDs/Sys4AI_phase-0_product_system_design_prd.md;PRDs/Sys4AI_phase-1_implementation_initialization_prd.md;implementation_plans/phase-1_environment_decision_record.md;Sys4AI/docs/docker_decision_guide.md;PRDs/modules/Sys4AI_operations_improvement_maintenance_prd.md,Expanded from TRACE-P0-LIFECYCLE. Phase 1 initializes the implementation boundary and defers later lifecycle runtime choices. AJ24 draft module owner: PRD-MOD-OPERATIONS-MAINTENANCE; not canonical.
TRACE-SFA-P0-NFR-008,SFA-P0-NFR-008,SRC-PRD-P0,partial,deferred,Phase 1 records baseline boundaries and Docker deferral; full lifecycle runtime execution is later-phase work.,sufficient,SFA-P1-INIT-REPO-004;SFA-P1-INIT-DOCKER-*,PRDs/Sys4AI_phase-0_product_system_design_prd.md;PRDs/Sys4AI_phase-1_implementation_initialization_prd.md;implementation_plans/phase-1_environment_decision_record.md;Sys4AI/docs/docker_decision_guide.md;PRDs/modules/Sys4AI_operations_improvement_maintenance_prd.md,Expanded from TRACE-P0-LIFECYCLE. Phase 1 initializes the implementation boundary and defers later lifecycle runtime choices. AJ24 draft module owner: PRD-MOD-OPERATIONS-MAINTENANCE; not canonical.
TRACE-SFA-P0-NFR-012,SFA-P0-NFR-012,SRC-PRD-P0,partial,deferred,Phase 1 records baseline boundaries and Docker deferral; full lifecycle runtime execution is later-phase work.,sufficient,SFA-P1-INIT-REPO-004;SFA-P1-INIT-DOCKER-*,PRDs/Sys4AI_phase-0_product_system_design_prd.md;PRDs/Sys4AI_phase-1_implementation_initialization_prd.md;implementation_plans/phase-1_environment_decision_record.md;Sys4AI/docs/docker_decision_guide.md;PRDs/modules/Sys4AI_operations_improvement_maintenance_prd.md,Expanded from TRACE-P0-LIFECYCLE. Phase 1 initializes the implementation boundary and defers later lifecycle runtime choices. AJ24 draft module owner: PRD-MOD-OPERATIONS-MAINTENANCE; not canonical.
TRACE-SFA-CORE-ART-001,SFA-CORE-ART-001,SRC-PRD-P0,partial,scaffolded,Phase 1 installs skill and control-record scaffolds; full role and artifact operation remains later-phase work.,sufficient,SFA-P1-INIT-SKILL-*;SFA-P1-INIT-YAML-*,PRDs/Sys4AI_phase-0_product_system_design_prd.md;PRDs/Sys4AI_phase-1_implementation_initialization_prd.md;Sys4AI/skills/core_skill_manifest.yaml;Sys4AI/registries/control_record_registry.csv;Sys4AI/docs/system_document_spine.md;Sys4AI/docs/skill_integration_policy.md;PRDs/modules/Sys4AI_role_governance_prd.md,Expanded from TRACE-P0-ROLE-ARTIFACTS. Phase 1 installs skill and control-record scaffolds for later role and artifact execution. AJ24 draft module owner: PRD-MOD-ROLE-GOVERNANCE; not canonical.
TRACE-SFA-CORE-ROLE-001,SFA-CORE-ROLE-001,SRC-PRD-P0,partial,scaffolded,Phase 1 installs skill and control-record scaffolds; full role and artifact operation remains later-phase work.,sufficient,SFA-P1-INIT-SKILL-*;SFA-P1-INIT-YAML-*,PRDs/Sys4AI_phase-0_product_system_design_prd.md;PRDs/Sys4AI_phase-1_implementation_initialization_prd.md;Sys4AI/skills/core_skill_manifest.yaml;Sys4AI/registries/control_record_registry.csv;Sys4AI/docs/system_document_spine.md;Sys4AI/docs/skill_integration_policy.md;PRDs/modules/Sys4AI_role_governance_prd.md,Expanded from TRACE-P0-ROLE-ARTIFACTS. Phase 1 installs skill and control-record scaffolds for later role and artifact execution. AJ24 draft module owner: PRD-MOD-ROLE-GOVERNANCE; not canonical.
TRACE-SFA-P0-FR-005,SFA-P0-FR-005,SRC-PRD-P0,partial,scaffolded,Phase 1 installs skill and control-record scaffolds; full role and artifact operation remains later-phase work.,sufficient,SFA-P1-INIT-SKILL-*;SFA-P1-INIT-YAML-*,PRDs/Sys4AI_phase-0_product_system_design_prd.md;PRDs/Sys4AI_phase-1_implementation_initialization_prd.md;Sys4AI/skills/core_skill_manifest.yaml;Sys4AI/registries/control_record_registry.csv;Sys4AI/docs/system_document_spine.md;Sys4AI/docs/skill_integration_policy.md,Expanded from TRACE-P0-ROLE-ARTIFACTS. Phase 1 installs skill and control-record scaffolds for later role and artifact execution.
