layer_id,layer_name,layer_type,canonical_roots,mutable_roots,derivative_roots,authority_notes,requires_director_decision_for_mutation,default_validators,owner,source_hash,last_validated_at,notes
development_system,Sys4AI-dev,development_system,.;.agents;.codex;scripts;PRDs;implementation_plans,.;.agents;.codex;scripts;PRDs;implementation_plans,docs/generated;.local,Active development workspace authority,true,make validate-dev-skills;make validate-product-scaffold,system_director,pending,pending,Self-hosting development workspace surface.
framework_product,Sys4AI,framework_product,Sys4AI;PRDs;implementation_plans,Sys4AI;PRDs;implementation_plans,Sys4AI/docs/generated,Product framework scaffold authority,true,cd Sys4AI && make validate,system_director,pending,pending,Framework product requirements and reference implementation surface.
target_system_template,Target system template,target_system_template,Sys4AI/templates;Sys4AI/skills/core,Sys4AI/templates;Sys4AI/skills/core,Sys4AI/docs/generated,Template authority only,true,cd Sys4AI && make validate,system_architect,pending,pending,Reusable target-system template surface.
target_system_instance,Concrete target system,target_system_instance,<future-target-root>,<future-target-root>,<future-target-root>/docs/generated,Project-specific authority,true,<target-system validators>,system_director,pending,pending,Concrete future target-system instance surface.
derivative_surface,Generated derivative surface,derivative_surface,docs/generated;Sys4AI/docs/generated,,docs/generated;Sys4AI/docs/generated,Non-canonical by default,true,validate-generated-derivatives,documentation_librarian,pending,pending,Generated derivative surfaces are navigation only unless promoted.
